{
  "$schema": "https://json-schema.org/draft/2020-12/schema",
  "$id": "oreflow-index-v2",
  "title": "oreflow-index-v2",
  "type": "object",
  "properties": {
    "schema": {
      "const": "oreflow.index/v2",
      "type": "string"
    },
    "engine_version": {
      "type": "string"
    },
    "contract_digest": {
      "type": "string"
    },
    "n_cases": {
      "type": "integer"
    },
    "n_variants": {
      "type": "integer"
    },
    "cases": {
      "type": "array"
    }
  },
  "required": [
    "schema",
    "engine_version",
    "contract_digest",
    "n_cases",
    "n_variants",
    "cases"
  ],
  "additionalProperties": true
}
