{"schema":"oreflow.index/v2","engine_version":"0.10.000","contract_digest":"0d2b65d272f3abcc6adffbf0f734c985cb002ab5cb665c109b8e8e9e31cecbd7","n_cases":12,"n_variants":96,"cases":[{"case_id":"copper_porphyry_soft","category":"liberation","family":"rougher","title":{"en":"Soft copper porphyry","es":"Pórfido de cobre blando"},"manifest_path":"manifests/copper_porphyry_soft.json","artifact_path":"cases/copper_porphyry_soft.json","variants":8},{"case_id":"copper_porphyry_hard","category":"liberation","family":"rougher","title":{"en":"Hard copper porphyry","es":"Pórfido de cobre duro"},"manifest_path":"manifests/copper_porphyry_hard.json","artifact_path":"cases/copper_porphyry_hard.json","variants":8},{"case_id":"gold_free_milling","category":"classification","family":"gravity_rougher","title":{"en":"Free-milling gold with gravity","es":"Oro de molienda libre con gravimetría"},"manifest_path":"manifests/gold_free_milling.json","artifact_path":"cases/gold_free_milling.json","variants":8},{"case_id":"iron_magnetite_fine","category":"liberation","family":"magnetic","title":{"en":"Fine magnetite concentration","es":"Concentración de magnetita fina"},"manifest_path":"manifests/iron_magnetite_fine.json","artifact_path":"cases/iron_magnetite_fine.json","variants":8},{"case_id":"nickel_sulphide","category":"classification","family":"deslime_rougher","title":{"en":"Nickel sulphide with serpentine slimes","es":"Sulfuro de níquel con lamas de serpentina"},"manifest_path":"manifests/nickel_sulphide.json","artifact_path":"cases/nickel_sulphide.json","variants":8},{"case_id":"phosphate_clay","category":"classification","family":"deslime_rougher","title":{"en":"Phosphate with clay slimes","es":"Fosfato con lamas arcillosas"},"manifest_path":"manifests/phosphate_clay.json","artifact_path":"cases/phosphate_clay.json","variants":8},{"case_id":"copper_molybdenum","category":"flotation","family":"rougher","title":{"en":"Copper-molybdenum bulk flotation","es":"Flotación colectiva cobre-molibdeno"},"manifest_path":"manifests/copper_molybdenum.json","artifact_path":"cases/copper_molybdenum.json","variants":8},{"case_id":"copper_oxide","category":"flotation","family":"rougher","title":{"en":"Oxide copper: assumed sulphidized response","es":"Cobre oxidado: respuesta sulfidizada supuesta"},"manifest_path":"manifests/copper_oxide.json","artifact_path":"cases/copper_oxide.json","variants":8},{"case_id":"zinc_sulfide","category":"flotation","family":"rougher","title":{"en":"Zinc sulphide","es":"Sulfuro de zinc"},"manifest_path":"manifests/zinc_sulfide.json","artifact_path":"cases/zinc_sulfide.json","variants":8},{"case_id":"mixed_ore_high_clay","category":"integration","family":"deslime_rougher","title":{"en":"Copper ore with clay","es":"Mineral de cobre con arcilla"},"manifest_path":"manifests/mixed_ore_high_clay.json","artifact_path":"cases/mixed_ore_high_clay.json","variants":8},{"case_id":"low_grade_copper","category":"integration","family":"rougher","title":{"en":"Low-grade copper at high throughput","es":"Cobre de baja ley a alto tratamiento"},"manifest_path":"manifests/low_grade_copper.json","artifact_path":"cases/low_grade_copper.json","variants":8},{"case_id":"refractory_gold","category":"integration","family":"rougher","title":{"en":"Refractory gold in sulphides","es":"Oro refractario en sulfuros"},"manifest_path":"manifests/refractory_gold.json","artifact_path":"cases/refractory_gold.json","variants":8}]}